key,id
title,Panduan Pendataan Perikanan
subtitle,Panduan penyelenggaraan survei untuk memperoleh data perikanan
intro,Pengenalan
p1,"Dokumen ini memberikan panduan dan rekomendasi untuk mengelola tiga instrumen survei untuk menangkap informasi tentang komunitas nelayan dan perikanan yang mereka andalkan (Gambar 1). Survei dirancang untuk menyelaraskan konten dengan bagaimana data akan digunakan dan frekuensi perubahan yang diharapkan. Survei tingkat tertinggi, Community Profiling, berisi pertanyaan-pertanyaan yang membantu membangun pemahaman yang lebih baik tentang aktivitas penangkapan ikan di masyarakat dan kondisi sosial ekonomi. Memahami lanskap sosial ekonomi sangat penting ketika pekerjaan pertama kali dimulai di sebuah komunitas. Informasi yang dikumpulkan selama survei ini sangat penting untuk merancang strategi keterlibatan masyarakat dan rencana pengambilan sampel data. Survei Profil dan Pemantauan Pendaratan mengumpulkan data tentang tangkapan yang didaratkan oleh perikanan. Data Profil Pendaratan dikumpulkan lebih jarang dan menangkap informasi tentang habitat penangkapan ikan, jenis peralatan, upaya, dan panjang ikan individu. Survei Pemantauan Pendaratan, idealnya dilakukan setiap hari, adalah survei perikanan cepat yang mengumpulkan informasi dalam jumlah minimum yang diperlukan untuk melacak volume tangkapan dan perubahan nilai, seperti spesies, bobot, jumlah, dan harga."
fig1,Gambar 1: Garis waktu untuk mengelola tiga instrumen survei yang berbeda dalam skala satu tahun.
survey,Rincian Survei
cps,Survei Profil Komunitas
goal,Tujuan
p2,Memahami lanskap umum masyarakat dan perikanan yang beroperasi di dalam masyarakat.
dc,Data yang Dikumpulkan
point1,"Jumlah anggota masyarakat, nelayan, pedagang ikan, perempuan"
point2,Lanskap umum perikanan yang beroperasi di masyarakat
point3,Roda gigi yang digunakan; spesies yang ditargetkan; habitat yang ditangkap; musim; kapal
point4,Informasi tentang usaha dan biaya penangkapan ikan
point5,"Persepsi tentang kondisi perikanan dan habitat, ancaman"
point6,Informasi tentang manajemen/peraturan perikanan saat ini
point7,"Identifikasi (melalui pemetaan) tempat penangkapan ikan yang penting, habitat, lokasi pendaratan"
ta,Target Pemirsa
p3,"10-20 informan kunci dalam masyarakat, yaitu tokoh masyarakat, nelayan terhormat, pedagang ikan, dan perempuan."
ft,Frekuensi dan Waktu
p4,"Ketika pekerjaan dimulai di komunitas nelayan baru, melakukan Survei Profil Komunitas dan latihan profil awal memberikan data dasar dan informasi yang relevan untuk merancang upaya konservasi dan pengelolaan yang paling tepat bagi masyarakat. Mengulangi Survei Profil Komunitas dapat membantu mendokumentasikan perubahan signifikan yang terjadi dari waktu ke waktu."
method,Metodologi
p5,"Informasi dapat dikumpulkan melalui survei pihak ketiga (yaitu, sensus, catatan departemen perikanan, dll.), kelompok fokus yang terdiri dari 10-20 anggota komunitas kunci atau informan kunci. Tokoh masyarakat serta berbagai nelayan dan pedagang ikan yang berpengetahuan luas dan beragam (termasuk perempuan dan anak muda) akan menjadi peserta yang ideal untuk dimasukkan dalam kelompok fokus. Dalam memfasilitasi kelompok fokus, disarankan untuk memiliki, minimal, fasilitator dan pencatat. Pada focus group juga disarankan agar peserta memberikan daftar / informasi kontak bagi para nelayan di masyarakat yang kemudian dapat dihubungi untuk mengurus Survei Rumah Tangga. Jika Survei Profil Komunitas tidak dapat dilakukan dalam format kelompok fokus, alternatifnya adalah dengan mengajukan pertanyaan yang sama seperti survei individu dengan informan kunci dan mengumpulkan tanggapannya. Pertanyaan yang termasuk dalam survei profil komunitas dan rekomendasi untuk melakukan diskusi kelompok terfokus dapat ditemukan di Lampiran A di bawah ini."
lms,Survei Pemantauan Pendaratan
p6,"Menangkap data kunci yang diperlukan untuk menghitung indikator kesehatan perikanan berbasis panjang yang sederhana dan untuk melacak perubahan dalam produksi, nilai, dan komposisi perikanan."
point8,Tanggal mendarat
point9,Lokasi pendaratan
point10,Nama pedagang ikan
point11,Nama Fisher
point12,Upaya Penangkapan Ikan (hari memancing/memungut)
point13,"Identitas spesies (lokal, umum, nama ilmiah)"
point14,Jumlah total
point15,Berat total
point16,Total harga
point17,"Alasan total tangkapan tidak terjual, jika ada"
p7,Nelayan saat mereka mendaratkan hasil tangkapannya atau di rumah/pasar pembeli ikan.
p8,"Survei Pemantauan Pendaratan harus dilakukan setiap hari atau sesering mungkin. Melakukan Survei Pemantauan Pendaratan sebelum dan sesudah pelaksanaan untuk mengevaluasi dampak penutupan perikanan atau strategi pengelolaan lainnya. Kami merekomendasikan pengumpulan data 30 hari sebelum dan sesudah periode penutupan sementara. Selama tujuh hari pertama periode pengambilan sampel, kami menyarankan agar pencacah melakukan Survei Pemantauan Pendaratan setiap hari. Jika memungkinkan, lanjutkan pemantauan harian selama periode 30 hari. Jika ini tidak memungkinkan, survei setidaknya 80% hari dalam setiap 30 hari. Kami juga merekomendasikan untuk mensurvei 80% atau lebih dari semua tangkapan pendaratan nelayan pada hari tertentu sebelum atau sesudah penutupan. Mendistribusikan upaya survei yang representatif antara nelayan perahu dan nelayan non-perahu. Kumpulkan data dari semua nelayan yang mendarat di desa, terlepas dari apakah mereka sedang memancing di dalam lokasi penutupan atau tidak."
p9,"Untuk penutupan jangka panjang, pastikan bahwa data dikumpulkan selama bulan yang sama untuk setiap tahun untuk menangkap perubahan selama periode penutupan. Jika itu tidak memungkinkan, kami sarankan untuk mengumpulkan data selama bulan yang sama sebelum dan sesudah penutupan. Seperti yang dinyatakan di atas, kami menyarankan untuk mensurvei setidaknya 80% hari dalam sebulan dan 80% tangkapan pendaratan nelayan setiap hari."
p10,"Dengan menggunakan formulir Kobo, temui nelayan di lokasi pendaratan / rumah pembeli untuk mencatat hasil tangkapannya."
lps,Survei Profil Pendaratan
p11,Pahami tren tangkapan yang diamati.
point18,Tanggal mendarat
point19,Lokasi pendaratan
point20,Tempat penangkapan ikan utama
point21,Nama pedagang ikan
point22,Nama Fisher
point23,Upaya Penangkapan Ikan (jam dan hari penangkapan/pengumpulan)
point24,"Jenis kapal (nomor registrasi kapal, nomor awak kapal)"
point25,"Identitas spesies (lokal, umum, nama ilmiah)"
point26,Roda gigi yang digunakan
point27,Habitat ditangkap
point28,Jumlah total
point29,Berat total
point30,Total harga
point31,"Alasan total tangkapan tidak terjual, jika ada"
point32,Sampel dengan berat dan panjang individu (Gambar 2-8)
point33,"Data sampel khusus mitra (jenis kelamin, kualitas tangkapan, gonad, stilet, # perangkap, dll.)"
p12,"Sampel tangkapan yang representatif di dalam komunitas. Catat setidaknya 50 sampel (idealnya 100) untuk setiap spesies target, yang mewakili berbagai jenis roda gigi dan profil nelayan."
p13,"Survei ini awalnya harus dilakukan pada awal keterlibatan dalam suatu komunitas dan selanjutnya dilakukan setiap satu hingga dua tahun, sebelum dan sesudah menerapkan strategi pengelolaan, atau sesuai kebutuhan untuk menjelaskan penurunan yang diamati melalui data pemantauan. Dengan menggunakan formulir Kobo, temui nelayan di lokasi pendaratan untuk mencicipi hasil tangkapan mereka dan mencatat aktivitas penangkapan ikan mereka."
p14,"Dengan menggunakan formulir Kobo, temui nelayan di lokasi pendaratan untuk mencicipi hasil tangkapan mereka dan mencatat aktivitas penangkapan ikan mereka."
ms,Standarisasi Pengukuran: Jenis panjang untuk diukur menurut kelompok spesies
fig2,"Gambar 2: Panjang total harus digunakan untuk mengukur ikan sirip, hiu, dan belut (AFS)."
fig3,Gambar 3: Lebar cakram harus digunakan untuk mengukur sinar dan sepatu roda.
fig4,"Gambar 4: Lebar karapas harus digunakan saat mengukur kepiting (Suryandari et. al, 2018)."
fig5,Gambar 5: Panjang mantel harus digunakan saat mengukur gurita dan cumi-cumi (FAO).
fig6,Gambar 6: Panjang karapas harus digunakan saat mengukur udang dan lobster (Hart et al. 2001).
fig7,Gambar 7: Panjang harus digunakan saat mengukur bivalvia dan gastropoda.
fig8,Gambar 8: Panjang total harus digunakan saat mengukur teripang. Lebar atau diameter uji harus digunakan saat mengukur bulu babi.
dfo,Gambaran Umum Alur Data
p15,"Barefoot Ocean memproses dan menganalisis data perikanan dan sosial ekonomi utama yang dimiliki oleh organisasi mitra melalui berbagi data. Dengan kata lain, mitra memiliki data tersebut, dan Barefoot Ocean memprosesnya. Pengumpulan data, validasi, transformasi, dan visualisasi adalah empat komponen utama dari sistem data Barefoot Ocean. Aplikasi perangkat lunak utama yang digunakan adalah KoBoToolbox, Smartsheet, PostgreSQL, dan R."
p16,"KoBoToolbox adalah perangkat lunak sumber terbuka dan gratis yang merupakan perangkat canggih untuk pengumpulan data yang dapat diakses melalui lingkungan yang menantang dan berbagai platform, seperti perangkat seluler, komputer, dan kertas. Pencacah mengumpulkan data tentang kondisi sosial ekonomi dan ekologi yang penting untuk menilai komunitas dan status perikanan melalui kuesioner survei KoBoToolbox Barefoot Ocean. Smartsheet adalah platform manajemen kerja kolaboratif yang menyediakan antarmuka yang fleksibel dan intuitif bagi organisasi untuk merencanakan, melacak, mengotomatiskan, dan mengelola berbagai proyek dan proses secara real-time. File referensi yang digunakan untuk mengisi formulir survei dan menghubungkan data tambahan ke kumpulan data master dikelola di Smartsheet. Selain itu, data divalidasi dalam Smartsheet. PostgreSQL adalah sistem manajemen basis data sumber terbuka dan gratis yang digunakan sebagai gudang data untuk berbagai aplikasi web, analitik, dan geospasial sambil menyimpan data tidak terstruktur dan terstruktur dalam satu produk. R adalah lingkungan perangkat lunak dan bahasa pemrograman sumber terbuka dan gratis yang banyak digunakan untuk ilmu data, komputasi statistik, dan visualisasi data. Dasbor data dibuat menggunakan paket Shiny dari bahasa pemrograman R dan dihosting di shinyapps.io, platform sebagai layanan (PaaS) untuk menghosting aplikasi web (aplikasi) Shiny."
fig9,Gambar 9: Diagram Alir Data Laut Tanpa Alas Kaki.
p17,"Pengumpulan data melibatkan pengumpulan dan pengukuran informasi secara sistematis dari sumber yang relevan tentang variabel yang diminati untuk pengambilan keputusan, perencanaan strategis, evaluasi hasil, dan tujuan lainnya. Dengan memasukkan data kuantitatif dan kualitatif dalam kuesioner survei, Barefoot Ocean berfokus pada survei metode campuran dalam proses pengumpulan data untuk mengembangkan pemahaman yang lebih mendalam tentang kondisi sosial ekonomi dan ekologi yang berkaitan dengan komunitas perikanan dan strategi pengelolaan adaptif. Validasi data mengacu pada penerapan metode untuk mengukur kondisi data yang dikumpulkan dan menentukan apakah data yang dikumpulkan memenuhi kriteria kualitas yang ditentukan, seperti akurasi, konsistensi, relevansi, kelengkapan, dan keunikan. Transformasi data mengubah, membersihkan, dan menyusun data mentah menjadi format yang dapat digunakan yang dapat dianalisis dan dinilai untuk pengambilan keputusan. Analisis dan visualisasi data melibatkan perancangan dan pembuatan grafik atau tampilan visual informasi yang dapat diakses untuk mengomunikasikan secara efektif data kualitatif dan kuantitatif kompleks yang sebelumnya dikumpulkan, diverifikasi, dan ditransformasikan ke seluruh audiens target. Kami telah menjelaskan proses aliran data di bawah ini:"
step1,Data dikumpulkan melalui formulir survei KoBoToolbox.
step2,Data ditarik ke dalam basis data Barefoot Ocean.
step3,"Jika pencacah memilih pilihan jawaban yang telah diisi sebelumnya dalam survei, data tersebut tidak perlu divalidasi dan dapat langsung masuk ke proses analisis dan visualisasi data."
step4,"Jika pencacah memasukkan data secara manual seperti nelayan baru, pembeli, pengumpul data, lokasi pendaratan, atau spesies, data diverifikasi di Smartsheet sebelum disertakan dalam tabel data akhir dan divisualisasikan di dasbor. Prospek tim lapangan diberi tahu melalui email saat data siap untuk validasi. Pemimpin tim akan memeriksa tabel kontrol kualitas secara manual untuk mengonfirmasi bahwa informasi yang baru ditambahkan valid."
step5,"Setelah validasi, data baru didorong ke file referensi dan kembali ke database untuk transformasi akhir sebelum analisis dan visualisasi."
step6,"Setelah data didorong ke file referensi, pemimpin tim akan diberi tahu melalui email jika ada informasi tambahan yang diperlukan dalam file referensi."
step7,File referensi yang diperbarui kemudian diunggah ke platform KoBoToolbox untuk dimasukkan ke dalam formulir.
step8,Data yang diperbarui dari file referensi juga digunakan dalam proses transformasi data untuk menggabungkan bidang data tambahan seperti koordinat dan jenis kelamin.
step9,Langkah terakhir dari proses transformasi data menghasilkan tabel data master yang digunakan untuk analisis dan visualisasi data di dasbor data.
step10,"Dasbor data (yaitu aplikasi mengkilap) terhubung langsung ke basis data, menarik data terbaru yang tersedia, sehingga memberikan mitra akses langsung ke data mentah dan ringkasan."
datasecurity,Keamanan Data
p18,Di bawah ini adalah daftar platform perangkat lunak tempat data dapat disimpan dan dipindahkan dalam perjalanan dari basis data. Informasi keamanan data untuk setiap platform eksternal tersedia di situs web khusus platform yang ditautkan di sini.
p19,Barefoot Ocean telah menerapkan beberapa prosedur keamanan data selain langkah-langkah keamanan data yang disediakan oleh platform perangkat lunak di atas. Semua akun di semua platform perangkat lunak yang digunakan oleh Barefoot Ocean dilindungi kata sandi.
p20,"Kami menggunakan Github sebagai sistem kontrol versi untuk produk berkode. Secara default, semua folder dan proyek dengan data perikanan dan sosial ekonomi bersifat pribadi dan hanya dapat diakses oleh staf dan kontraktor Barefoot Ocean."
p21,"Dari platform data bersama mana pun (mis., Shiny Apps), autentikasi pengguna diperlukan untuk melihat atau mengunduh data, bergantung pada perjanjian berbagi data yang dipilih oleh masing-masing organisasi mitra. Ini termasuk verifikasi pengguna sebelum mengizinkan data dilihat atau diunduh, pengguna masuk ke platform visualisasi data, dan pengelolaan rutin pengguna terverifikasi oleh tim Barefoot Ocean."
p22,"Akses ke dokumen Smartsheet (mis. file referensi, lembar validasi data) dibatasi untuk personel yang diidentifikasi oleh masing-masing organisasi, dan setiap mitra hanya dapat melihat informasi khusus mitra mereka sendiri. Pengecualian untuk ini termasuk staf Barefoot Ocean yang mengontrol dan membantu alur kerja kualitas data, dan staf Blue Ventures yang membantu mitra dengan alur kerja informasi di Smartsheet."
p23,Akses ke basis data utama Barefoot Ocean terbatas pada staf dan kontraktor Barefoot Ocean.
dp,Privasi Data
p24,"Informasi identitas pribadi (PII) dan data tangkapan perikanan dimiliki oleh nelayan dan pembeli ikan dan tidak akan pernah dibagikan tanpa persetujuan sebelumnya. Untuk melindungi privasi nelayan, pembeli, dan pengumpul data, semua nama dianonimkan menjadi nomor identifikasi acak. Oleh karena itu, semua data yang tersedia sebagian atau seluruhnya untuk umum hanya akan menyertakan nomor id numerik acak. Lihat bagian berbagi data untuk penjelasan lengkap tentang perjanjian berbagi data."
p25,Data yang dianggap PII meliputi:
point34,"Nama nelayan, pembeli, dan pengumpul data"
point35,Nama responden untuk survei apa pun
datasharing,Berbagi Data
p26,"Sistem data perikanan Laut Barefoot dirancang untuk merampingkan pemanfaatan data Anda dan menyediakan platform untuk keterlibatan aktif Anda dalam upaya pengelolaan dan konservasi perikanan yang lebih luas. Data gabungan yang dikumpulkan secara kolaboratif di seluruh mitra dapat menghasilkan wawasan yang kuat untuk memantau perikanan, menilai strategi pengelolaan, memandu pengambilan keputusan di tingkat lokal dan nasional, memahami perubahan regional, dan mengidentifikasi layanan keuangan potensial."
p27,"Kami menyadari pentingnya kepemilikan dan penggunaan data untuk semua mitra yang berkontribusi. Tujuan kami adalah memberi Anda fleksibilitas dalam mengelola dan menentukan bagaimana data Anda digunakan. Dengan memilih salah satu dari tiga tingkat izin penggunaan data, Anda dapat mengatur sejauh mana data Anda dibagikan dengan pengguna lain. Anda dapat menyesuaikan tingkat izin berdasarkan tipe data, dan yang terpenting, Anda memiliki kebebasan untuk menyesuaikan tingkat izin data Anda kapan saja. Informasi identitas pribadi (PII) dan data tangkapan perikanan dimiliki oleh nelayan dan pembeli ikan dan tidak akan pernah dibagikan tanpa persetujuan sebelumnya. Dengan memilih tingkat izin penggunaan data, Anda mengonfirmasi bahwa izin individual telah diperoleh dari nelayan dan pembeli ikan."
p28,Semua data saat ini disetel ke Level 1-Pribadi. Pengguna akan memiliki kesempatan untuk menyesuaikan tingkat izin mereka sesuai kebutuhan.
level1,Tingkat 1-Pribadi
point36,Data hanya untuk tujuan internal kontributor data asli.
point37,Data akan tersedia untuk diunduh oleh kontributor data asli.
point38,Data tidak akan disertakan dalam analisis regional yang disediakan di dasbor.
point39,Dilarang keras membagikan atau mendistribusikan data secara tidak sah kepada pihak eksternal.
level2,Level 2-Berbagi dengan Kontributor Data Lainnya
point40,Data tingkat perjalanan tersedia untuk diunduh oleh kontributor data lainnya.
point41,Ringkasan dan visualisasi data akan tersedia untuk kontributor data lainnya.
point42,Data akan dimasukkan dalam analisis regional di dasbor.
level3,Level 3-Berbagi dengan Semua Pengguna
point43,Data tingkat perjalanan tersedia untuk diunduh semua pengguna.
point44,Ringkasan dan visualisasi data akan tersedia untuk semua pengguna.
point45,Data akan dimasukkan dalam analisis regional di dasbor.
point46,Kontributor data asli dapat menentukan batasan atau ketentuan penggunaan apa pun yang berlaku untuk semua pengguna.
newdata,Memvalidasi Data Baru dan yang Ditandai
p29,"Dalam survei, beberapa pertanyaan memungkinkan pencacah untuk menambahkan nelayan baru, pembeli, pengumpul data, lokasi pendaratan, spesies, atau ""lainnya.""Informasi dari opsi ini adalah titik data baru dan harus menjalani verifikasi sebelum didorong ke kumpulan data akhir, divisualisasikan di dasbor, dan ditambahkan ke file referensi. Ada juga batasan yang ditetapkan pada berat, harga, dan panjang suatu spesies, dan jika data yang dikumpulkan di bawah atau di atas batasan ini, nilai-nilai ini ditandai untuk ditinjau. Batasan berat dan harga ditetapkan oleh mitra dalam min_max_ref. Batasan panjang spesies ditetapkan oleh tim Barefoot Ocean menggunakan parameter biologis."
p30,"Semua data yang mengalir melalui sistem data perikanan divalidasi dalam Smartsheet. Salah satu entri baru atau yang ditandai ini dikirim ke tabel kontrol kualitas (QA) di Smartsheet untuk divalidasi oleh tim lapangan. Tabel kontrol kualitas khusus untuk mitra dan dapat diakses melalui permintaan pembaruan yang dikirim ke email Anda atau dengan mengunjungi tautan Tampilan Dinamis yang disediakan untuk Anda. Prospek tim lapangan akan diberi tahu melalui email saat data perlu divalidasi dalam tabel QA. Setelah data diverifikasi dalam tabel QA, kami akan menambahkan informasi baru ke file referensi dan memberikan koreksi yang diperlukan pada kumpulan data master."
p31,Petunjuk langkah demi langkah khusus tentang cara menyelesaikan validasi data di Smartsheet dapat ditemukan di halaman Validasi Data.
datacol,Pengumpulan Data
p32,"Barefoot Ocean mengelola semua survei melalui formulir Kobo Toolbox yang dapat dibagikan melalui akun Kobo Toolbox. Anda dapat membuat akun di https://kf.kobotoolbox.org/accounts/signup/. Silakan hubungi tim Barefoot Ocean dengan nama pengguna dan detail akun Anda. Setelah survei dibagikan, akses formulir Kobo melalui aplikasi ponsel Android gratis KoboCollect atau melalui formulir web Enketo. Petunjuk terperinci tentang menyiapkan akun Kobo, mengumpulkan data, dan mengirimkan data dapat ditemukan di halaman Penyiapan Kobo. Gunakan kode QR untuk mengonfigurasi semua perangkat setelah menyiapkan ponsel atau tablet pertama secara manual untuk menyiapkan beberapa ponsel atau tablet dalam satu akun pengumpulan data. Pengaturan manual perangkat pertama memerlukan URL server Kobo, nama pengguna, dan kata sandi. URL server Kobo adalah https://kc.kobotoolbox.org. Informasi lebih lanjut tentang pengaturan pengumpulan data dengan Kobo, termasuk cara mengonfigurasi beberapa perangkat pengumpulan data melalui kode QR, dapat ditemukan di https://support.kobotoolbox.org/."
p33,"Setelah Anda mengunduh KoboCollect, buka aplikasi dan masukkan URL server, nama pengguna, dan kata sandi untuk menghubungkan aplikasi KoboCollect Anda ke server KoBoToolbox. Menghubungkan aplikasi KoboCollect ke server KoBoToolbox memungkinkan Anda mengunduh formulir yang diterapkan dari KoBoToolbox ke perangkat seluler Anda dan mengirim data yang dikumpulkan melalui aplikasi kembali ke server. Di layar beranda, pilih ""Dapatkan Formulir Kosong.""Daftar semua formulir survei yang Anda gunakan akan muncul. Tekan ""Pilih Semua"" agar semua formulir survei dikirim ke aplikasi, atau pilih formulir yang ingin Anda miliki dengan memilihnya secara manual. Kemudian klik ""Terpilih.""Untuk menerapkan survei, pilih"" Isi Formulir Kosong.”"
p34,"Meskipun formulir web diperbarui secara otomatis saat versi survei baru tersedia, pengguna harus mengonfigurasi sendiri ""pembaruan otomatis"" di aplikasi. Memperbarui survei di aplikasi secara teratur memastikan penggunaan formulir versi terbaru dan tidak menyebabkan masalah alur data. Anda dapat mengatur pembaruan otomatis di aplikasi dengan membuka ""Pengaturan ""dan"" Manajemen Formulir.""Informasi lebih lanjut tentang memperbarui survei secara otomatis di aplikasi dapat ditemukan di halaman Pengaturan Kobo. Penting untuk diperhatikan bahwa koneksi diperlukan agar aplikasi dapat menarik versi survei terbaru, bahkan dengan pengaturan pembaruan otomatis diaktifkan. Oleh karena itu, sarankan pencacah untuk memiliki koneksi internet sebelum melakukan pekerjaan lapangan sehingga KoboCollect dapat menarik versi terbaru."
p35,"Setelah mengumpulkan data, survei yang dikirimkan melalui formulir web akan dikirimkan secara otomatis ke server setelah pengumpul data menekan tombol ""Kirim"". Data yang dikumpulkan melalui aplikasi KoboCollect pertama kali disimpan di aplikasi di tempat penyimpanan dan kemudian didorong ke server. Survei yang telah selesai tetap ditahan sebelum dikirimkan ke server sehingga pengumpul data dapat mengedit survei setelah mengumpulkan data, atau jika tidak ada koneksi internet, aplikasi dapat menyimpan survei dan kemudian mendorong survei ke server setelah ada konektivitas internet. Secara khusus, saat survei selesai, pengguna akan menekan ""Simpan formulir dan keluar"", memastikan bahwa"" Tandai formulir sebagai selesai "" juga dicentang. ""Edit Formulir Tersimpan"" secara otomatis menyimpan formulir yang disimpan. Pengumpul data dapat membuat perubahan yang diperlukan dan memilih ""Simpan Formulir dan Keluar.""Layar beranda juga memiliki tombol bernama"" Kirim Formulir yang Telah Diselesaikan.""Tekan Pilih Semua (atau pilih yang ingin Anda unggah) lalu tekan"" Kirim yang Dipilih.""Pilih"" Lihat Formulir Terkirim"" untuk memastikan berhasil mengunggah formulir dan Anda sekarang dapat melihat semua formulir yang dikirimkan."
p36,"Sistem penyimpanan data pusat terhubung ke data Kobo, dan analisis serta visualisasi otomatis akan tersedia melalui dasbor standar. Data mentah dicadangkan dalam basis data KoBoToolbox dan akan tersedia melalui unduhan atau tautan langsung ke basis data atau gudang data lain."
translations,Terjemahan
p37,"Terjemahan untuk semua bahasa diselesaikan dengan mengedit lembar terjemahan di Smartsheet. Jika Anda menemukan bahwa terjemahan perlu diperbarui atau salah dalam survei, harap langsung perbarui terjemahan yang sesuai di lembar Smartsheet yang sesuai. Jika tim Barefoot Ocean membutuhkan terjemahan baru, mereka akan berkomentar dan menugaskan tugas tersebut kepada pimpinan tim country."
ref,File Referensi
p38,"File referensi bersifat khusus mitra atau negara dan berisi informasi lengkap tentang tingkat administrasi komunitas nelayan (negara, provinsi, kabupaten, desa), lokasi pendaratan, nelayan, pembeli, pengumpul data, data spesies, wilayah pengelolaan, jenis habitat, jenis peralatan, dan organisasi mitra. Beberapa informasi mengisi daftar tarik-turun dalam survei, dan beberapa digabungkan ke kumpulan data master setelah data dikumpulkan. Informasi baru harus ditambahkan langsung ke lembar referensi."
p39,Petunjuk langkah demi langkah khusus tentang cara memperbarui file referensi di Smartsheet dapat ditemukan di halaman File Referensi.
appendixa,Lampiran A: Panduan Diskusi Kelompok Fokus
p40,Pertimbangan penting sebelum melakukan profil atau survei perikanan
p41,Hubungan dan kepercayaan
p42,"Membangun relasi dan mendapatkan kepercayaan dari masyarakat merupakan langkah awal yang penting sebelum menanyakan informasi perikanan. Langkah pertama untuk membangun hubungan dan mendapatkan kepercayaan masyarakat adalah memperkenalkan diri Anda, organisasi Anda, dan tujuan melakukan profil perikanan."
p43,Persiapan
p44,"Persiapan penting dalam menjalankan setiap metode survei, karena persiapan yang baik akan membuat Anda yakin akan efektivitas setiap metode yang Anda terapkan."
p45,Waktu untuk mengumpulkan informasi
p46,Sesuaikan waktu pelaksanaan setiap metode dengan waktu calon responden atau kelompok masyarakat yang dituju.
p47,Responden
