key,id
p48,"Memahami calon responden yang akan Anda temui selama pembuatan profil perikanan sangat penting untuk melakukan survei. Kelompok atau individu yang akan mengikuti survei harus menerima pemberitahuan terlebih dahulu. Oleh karena itu, memperkenalkan tokoh masyarakat yang berpengaruh harus menjadi bagian dari pekerjaan pra-survei."
p49,Logistik
p50,Setiap metode memiliki kebutuhan logistik dan material. Pastikan bahwa sumber daya dan peralatan yang dibutuhkan untuk setiap metode pembuatan profil perikanan telah disiapkan.
p51,Daftar kontak orang kunci
p52,Simpan daftar kontak orang kunci di ponsel Anda dan juga miliki versi cetak untuk dicadangkan.
p53,Kesehatan dan keselamatan
p54,Pastikan Anda berada dalam kondisi yang baik untuk melakukan profil perikanan. Bawalah perlengkapan pertolongan pertama yang penting.
p55,Panduan Diskusi Kelompok Fokus
p56,"Berikut ini berisi panduan dan rekomendasi untuk melakukan kelompok fokus untuk menangkap informasi profil komunitas. Dianjurkan untuk mengadakan sesi kelompok fokus untuk mendorong dialog, menangkap keragaman pendapat, dan mulai membangun hubungan dengan anggota komunitas yang penting. Namun, jika kelompok fokus tidak memungkinkan, survei profil komunitas dapat dilakukan sebagai wawancara individu dengan pemangku kepentingan penting menggunakan formulir Kobo ""Survei Profil Komunitas"". Secara keseluruhan, tujuan dari latihan profil komunitas, baik dalam format kelompok fokus atau wawancara individu, adalah untuk memahami lanskap umum komunitas dan perikanan yang beroperasi di dalam komunitas."
p57,Sebelum melakukan focus group
p58,"Sebelum menjadi tuan rumah kelompok fokus profil perikanan formal, disarankan untuk melakukan percakapan informal dan observasi partisipan. Metode ini berarti meluangkan waktu, membangun relasi, dan memahami perikanan dengan menggunakan percakapan informal dan observasi partisipan."
p59,"Percakapan informal penting untuk lebih memahami konteks perikanan secara umum sebelum melakukan diskusi kelompok terfokus. Gunakan metode ini sebagai salah satu titik tolak untuk merumuskan isi focus group discussion. Metode ini akan memungkinkan Anda untuk mengenal komunitas perikanan, mulai membangun hubungan, dan mendapatkan kepercayaan."
p60,Kiat yang disarankan untuk melakukan percakapan informal:
tip1,"Hormati perbedaan budaya. Patuhi norma-norma sosial seperti sapaan yang dapat diterima, aturan berpakaian, dan menghormati praktik keagamaan. Bersikaplah sopan, rendah hati, dan dengarkan pendapat pemangku kepentingan tanpa memaksakan pendapat Anda sendiri. Tetap berada dalam komunitas, membangun hubungan baik, dan berbagi makanan dapat membantu membangun kepercayaan."
tip2,"Habiskan waktu bersama para pemangku kepentingan. Tidak ada jalan pintas untuk mendapatkan kepercayaan dan dukungan. Apalagi di dalam komunitas itu bagus untuk dilihat, menghabiskan waktu di desa-desa dan bertemu orang-orang. Bersiaplah untuk membahas isu-isu yang lebih luas di dalam komunitas. Jangan mencoba memaksakan satu agenda tertentu."
tip3,"Gunakan bahasa lokal jika memungkinkan, kecuali jika bahasa umum dapat diakses. Jika tidak, gunakan penerjemah. Berhati-hatilah terhadap kesalahan dalam penerjemahan. Pemeriksaan silang terjemahan antara lebih dari satu juru bahasa dapat membantu mengurangi salah tafsir."
tip4,"Jangan membuat janji yang tidak bisa ditepati. Jelaskan tujuan dan hasil yang diharapkan tanpa meningkatkan ekspektasi. Hal ini penting untuk ditegaskan sejak dini agar masyarakat memiliki pemahaman yang jelas tentang peran mitra teknis, yaitu memfasilitasi penutupan perikanan gurita, bukan menggali sumur atau memperbaiki sekolah. Penting untuk memastikan semua orang mengetahui apa yang dapat dan tidak dapat dilakukan organisasi dalam komunitas. Memastikan ekspektasi yang realistis membantu meminimalkan kekecewaan, keluhan, dan konflik saat proyek berlangsung."
tip5,Komunikasikan rencana dan kegiatan secara luas. Pastikan setiap rapat atau kegiatan direncanakan sebelumnya dan pada waktu dan lokasi yang disepakati bersama untuk memaksimalkan kehadiran. Pastikan setiap perubahan dalam rencana dan kegiatan dikomunikasikan sedini mungkin. Tepat waktu dan berpegang teguh pada kesepakatan membantu membangun kepercayaan dan kepercayaan di antara para pemangku kepentingan.
tip6,Selalu akui pemangku kepentingan dalam keluaran proyek seperti laporan dan rilis media dalam rapat pemangku kepentingan dan presentasi eksternal. Waspadai 'kepemilikan' informasi dan hormati kerahasiaan dan privasi.
p61,"Pemahaman yang lebih baik tentang lanskap pemangku kepentingan di masyarakat merupakan tujuan penting dalam melakukan konservasi informal dan observasi partisipan. Stakeholder mempengaruhi atau dapat dipengaruhi oleh tindakan organisasi. Dukungan mereka sangat penting bagi keberhasilan organisasi dalam mengimplementasikan rencana pengelolaan perikanan. Dengan memahami pemangku kepentingan dengan lebih baik, Anda akan secara efektif mengidentifikasi pemangku kepentingan yang terlibat dalam pemantauan perikanan di masa mendatang untuk pengelolaan perikanan di wilayah mereka."
examples,Contoh jenis pemangku kepentingan yang harus disertakan:
example1,Nelayan
example2,Kepala Desa
example3,Pemimpin agama / agama
example4,Kepala daerah
example5,Petugas kesehatan masyarakat / praktisi kesehatan
example6,Pembeli/pemasok desa
example7,Pabrik pengolahan
example8,Wanita di desa / istri nelayan
p62,Informasi yang akan dikumpulkan tentang pemangku kepentingan:
point47,"Informasi tentang pemangku kepentingan utama dan posisi mereka dalam kaitannya dengan tujuan entitas (tingkat dukungan, kekuasaan, dll.). Informasi ini dapat digunakan untuk mengidentifikasi pemangku kepentingan mana yang akan disertakan dalam kelompok fokus profil komunitas."
p63,"Setelah melakukan percakapan informal, langkah selanjutnya yang bisa Anda lakukan adalah observasi partisipan. Observasi adalah metode yang memungkinkan Anda menggunakan peristiwa di sekitar Anda untuk mengumpulkan petunjuk dan menghasilkan kesimpulan tentang tempat atau pengalaman tertentu dengan mengamati satu hari di desa nelayan. Metode ini diperlukan untuk mengumpulkan bukti dari informasi yang diberikan dalam percakapan informal. Metode ini memungkinkan Anda untuk memahami aktivitas kehidupan sehari-hari desa nelayan."
p64,Prosedur Kelompok Fokus
2a,Mengorganisir kelompok fokus
2a.1,"Penting untuk menjaga hubungan baik dengan komunitas sasaran. Oleh karena itu, jika memungkinkan, desa-desa harus diberitahu tentang program pertemuan kelompok fokus setidaknya dua minggu sebelumnya."
2a.2,"Jika desa memiliki resepsionis telepon seluler, hubungi kepala desa atau kontak lokal lainnya."
2a.3,"Jika desa tidak memiliki resepsionis telepon seluler, lakukan kunjungan ke desa untuk bertemu dengan kepala desa atau kontak lokal lainnya."
2a.4,"Selama panggilan telepon atau kunjungan dengan kepala desa atau kontak lokal lainnya ini, jelaskan hal-hal berikut:"
2a.4.1,Tujuan pertemuan
2a.4.2,Lokasi pertemuan
2a.4.3,Tanggal dan waktu rapat
2a.4.4,Metode menginformasikan peserta rapat
2a.4.5,Jumlah peserta
2a.4.5.1,Semua penduduk desa atau orang spesial berdasarkan nelayan terbaik (2)
2a.4.5.2,Nelayan paling sering (2)
2a.4.5.3,Nelayan yang sering mengunjungi berbagai lokasi penangkapan ikan (2)
2a.4.5.4,Nelayan yang dihormati lebih disukai dengan pengalaman dalam pemetaan (2)
2a.5,Perempuan-tanyakan kepada kepala desa apakah kelompok fokus dapat dilakukan dengan kedua jenis kelamin hadir bersama sebelumnya karena di beberapa daerah hal ini tidak selalu memungkinkan.
2a.6,"Cobalah untuk menghindari melakukan pertemuan selama pasang surut musim semi/musim penangkapan ikan yang tinggi, karena banyak dari nelayan yang dibutuhkan kemungkinan besar akan sibuk memancing."
2a.7,Pastikan untuk memeriksa jadwal proyek lain yang mungkin bekerja di area yang sama pada waktu yang sama untuk menghindari bentrokan.
2b,Tim grup fokus
p65,"Berikut ini adalah peran yang direkomendasikan untuk tim yang memimpin grup fokus. Minimal, kelompok fokus harus memiliki fasilitator dan pencatat."
p66,Fasilitator utama: Memimpin dan memoderasi rapat
2b.1,Memperkenalkan rapat
2b.2,Memfasilitasi acara
2b.3,Memoderasi proses
2b.4,Bertindak sebagai katalisator antara individu-individu dalam kelompok
2b.5,Menemukan cara untuk mengintegrasikan orang-orang yang dominan dan pendiam dan memastikan bahwa semua anggota kelompok dapat mengungkapkan pendapat mereka
2b.6,Memastikan bahwa grup tetap berpegang pada topik tetapi juga fleksibel dalam menangani informasi penting tambahan
2b.7,Mengulangi dengan kata-kata sendiri apa yang dikatakan orang untuk memastikan bahwa ada pemahaman yang baik tentang diskusi tersebut
2b.8,Mengurus manajemen waktu
p67,"Asisten Fasilitator: Membantu fasilitator utama, terutama dalam menampilkan alat bantu visual"
2b.9,Mendukung pencatat dalam mengumpulkan semua informasi yang relevan
2b.10,"Memimpin tampilan alat bantu visual dan membantu komponen interaktif rapat lainnya seperti menghitung suara, mencatat yang ditampilkan, membagikan materi, dll."
2b.11,Membawa serta materi yang diperlukan
2b.12,"Membantu fasilitator secara tidak langsung dengan memberi isyarat (mis., menunjukkan siapa yang ingin berbicara)."
2b.13,"Mendukung fasilitator secara langsung dengan mengajukan pertanyaan, jika situasi mengharuskannya."
p68,Pencatat: Mendokumentasikan rapat
2b.14,Mengamati peristiwa dari latar belakang
2b.15,Menangkap semua tanggapan. Akan sangat membantu jika daftar pertanyaan dicetak sehingga dapat dianotasi dengan catatan selama rapat.
2b.16,Menuliskan semua informasi penting
2b.17,Catatan siapa yang berbicara. Apakah ada partisipasi yang setara dari semua atau apakah beberapa orang mendominasi prosesnya? Apakah wanita berbicara?
2c,Peserta kelompok fokus
p69,"Rencanakan dengan cermat siapa yang akan diundang ke rapat kelompok fokus. Disarankan untuk mengidentifikasi 10-12 individu untuk memastikan ukurannya dapat dikelola, memungkinkan representasi yang memadai dari perspektif yang berbeda. Sebisa mungkin, sertakan perwakilan dari beragam kelompok pemangku kepentingan dan sektor masyarakat (lihat contoh jenis pemangku kepentingan pada bagian di atas). Saat memilih peserta, pertimbangkan pengetahuan dan peran mereka di komunitas. Mengundang orang-orang yang lebih berpengetahuan tentang perikanan dan masyarakat, seperti nelayan penuh waktu daripada nelayan rekreasi sesekali, akan memberikan informasi yang lebih kuat dan akurat. Mengidentifikasi dan mengundang orang-orang yang dihormati di komunitas membantu membangun kepercayaan."
2d,Diskusi logistik dan metodologi
p70,"Data dapat diambil dalam formulir Kobo ""Survei Profil Komunitas"". Namun, mungkin lebih mudah bagi pencatat untuk menangkap data melalui catatan tertulis agar lebih mudah menangkap nuansa dan informasi yang muncul dari diskusi kelompok, seperti perbedaan jawaban per responden."
p71,"Jika informasi dikumpulkan dengan membuat catatan. Setelah pertemuan kelompok fokus selesai, tanggapan harus dimasukkan ke dalam formulir Kobo ""Survei Profil Komunitas""."
p72,Dorong semua anggota kelompok untuk berbicara karena mereka mewakili campuran usia dan kedudukan sosial yang mungkin memiliki pengalaman berbeda dalam perikanan.
p73,"Mengajukan pertanyaan satu per satu kepada kelompok dan menunggu tanggapan relawan adalah salah satu pendekatan untuk memimpin diskusi. Namun, memvariasikan cara fasilitator mengumpulkan tanggapan dapat membantu menjaga diskusi tetap menarik dan juga memastikan bahwa semua suara didengar dan peserta yang kurang vokal dapat berpartisipasi. Sebelum memulai kelompok fokus, pikirkan bagaimana Anda ingin mendapatkan tanggapan untuk setiap pertanyaan yang direncanakan."
2d.1,Forum terbuka-Siapa pun dapat menanggapi pertanyaan dan berbicara.
2d.2,"Panggil peserta tertentu – Ini dapat membantu memastikan bahwa peserta yang kurang vokal diberi kesempatan untuk berbicara. Ini dapat digunakan nanti dalam diskusi setelah fasilitator mengetahui peserta mana yang dapat memperoleh manfaat dari pemanggilan. Alternatifnya, seorang fasilitator dapat menggunakan teknik ini ketika mereka mengetahui bahwa peserta tertentu memiliki pengetahuan atau informasi penting terkait suatu pertanyaan."
2d.3,"Respon cepat-Berputar-putar dan setiap orang dengan singkat membagikan pendapat/tanggapan mereka terhadap pertanyaan tersebut. Ini bisa efektif dalam pemungutan suara penonton karena melibatkan semua orang. Namun, pastikan untuk mengomunikasikan dan menerapkan batasan waktu dengan jelas atau metode ini dapat menghabiskan terlalu banyak waktu diskusi."
2d.4,Pemungutan suara-Jajak pendapat penonton dengan mengajukan pertanyaan dan meminta orang mengangkat tangan sesuai dengan pilihan tanggapan yang berbeda. Ini dapat dilakukan secara terbuka atau anonim dengan mata tertutup atau dengan orang-orang menulis tanggapan mereka di selembar kertas terlipat yang kemudian dikumpulkan.
2d.5,"Grup-Bagi grup menjadi grup-grup kecil yang berdiskusi dan melapor kembali ke grup utama. Teknik ini sangat membantu dengan grup besar ketika tidak ada cukup waktu bagi semua anggota grup untuk berpartisipasi dalam forum grup lengkap. Dalam situasi ini, pastikan bahwa setiap kelompok memiliki pemangku kepentingan yang mewakili pendapat dan perspektif yang berbeda."
p74,Pertanyaan Kelompok Fokus
p75,"Mulailah kelompok fokus dengan memperkenalkan diri Anda, proyek, dan tujuan rapat. Kemudian, mintalah semua orang di ruangan itu memperkenalkan diri. Rencanakan metode terbaik untuk setiap pertanyaan untuk mendapatkan dan mengumpulkan tanggapan sebelumnya (lihat bagian di atas untuk ide). Silakan lihat dokumen Survei Profil Komunitas untuk daftar lengkap pertanyaan kelompok fokus yang akan dibahas."
p76,Sumber Daya Fasilitasi (tersedia dalam bahasa Inggris)
